{"$schema":"https://json-schema.org/draft/2020-12/schema","$id":"https://jichi-insight.example/schemas/phase10_uniformity.schema.json","title":"Phase 10 nationwide uniform depth","type":"object","additionalProperties":false,"required":["id","phase","status","scope_version","dimensions","default_depth","default_work","overrides","completion_rule","policy_achievement_assessment_status","ranking_eligibility","updated_at"],"properties":{"id":{"const":"phase10-nationwide-uniform-depth"},"phase":{"const":10},"status":{"enum":["in_progress","verification_pending","complete"]},"scope_version":{"type":"string","format":"date"},"dimensions":{"type":"array","minItems":11,"maxItems":11,"uniqueItems":true,"items":{"type":"object","additionalProperties":false,"required":["id","label","completion_status"],"properties":{"id":{"$ref":"#/$defs/dimension"},"label":{"type":"string","minLength":1},"completion_status":{"$ref":"#/$defs/status"}}}},"default_depth":{"$ref":"#/$defs/depth"},"default_work":{"type":"object","additionalProperties":false,"required":["status","next_gate","next_action_template"],"properties":{"status":{"$ref":"#/$defs/workStatus"},"next_gate":{"$ref":"#/$defs/gate"},"next_action_template":{"type":"string","minLength":20}}},"overrides":{"type":"object","propertyNames":{"pattern":"^(0[1-9]|[1-3][0-9]|4[0-7])$"},"additionalProperties":{"type":"object","additionalProperties":false,"required":["status","current_depth","next_gate","next_action"],"properties":{"status":{"$ref":"#/$defs/workStatus"},"current_depth":{"type":"object","minProperties":1,"propertyNames":{"$ref":"#/$defs/dimension"},"additionalProperties":{"$ref":"#/$defs/status"}},"next_gate":{"$ref":"#/$defs/gate"},"next_action":{"type":"string","minLength":20}}}},"completion_rule":{"type":"object","additionalProperties":false,"required":["description","required_prefecture_count","allow_partial_complete"],"properties":{"description":{"type":"string","minLength":50},"required_prefecture_count":{"const":47},"allow_partial_complete":{"const":false}}},"policy_achievement_assessment_status":{"const":"not_assessed"},"ranking_eligibility":{"const":"excluded_until_comparability_verified"},"updated_at":{"type":"string","format":"date"}},"$defs":{"dimension":{"enum":["target_statements","evidence_packets","annual_actuals","budget","settlement","priority_projects","contracts","assembly","audit","executive_manifesto","publication"]},"status":{"enum":["not_indexed","indexed","reviewed","linked"]},"workStatus":{"enum":["queued","source_indexing","linkage_in_progress","review_ready","complete"]},"gate":{"enum":["source_inventory","annual_actuals_linkage","money_linkage","action_linkage","accountability_linkage","publication_verification"]},"depth":{"type":"object","additionalProperties":false,"required":["target_statements","evidence_packets","annual_actuals","budget","settlement","priority_projects","contracts","assembly","audit","executive_manifesto","publication"],"properties":{"target_statements":{"$ref":"#/$defs/status"},"evidence_packets":{"$ref":"#/$defs/status"},"annual_actuals":{"$ref":"#/$defs/status"},"budget":{"$ref":"#/$defs/status"},"settlement":{"$ref":"#/$defs/status"},"priority_projects":{"$ref":"#/$defs/status"},"contracts":{"$ref":"#/$defs/status"},"assembly":{"$ref":"#/$defs/status"},"audit":{"$ref":"#/$defs/status"},"executive_manifesto":{"$ref":"#/$defs/status"},"publication":{"$ref":"#/$defs/status"}}}}}