{
  "id": "phase10-nationwide-uniform-depth",
  "phase": 10,
  "status": "complete",
  "scope_version": "2026-08-01",
  "dimensions": [
    {
      "id": "target_statements",
      "label": "政策・KPI",
      "completion_status": "reviewed"
    },
    {
      "id": "evidence_packets",
      "label": "Evidence Packet",
      "completion_status": "reviewed"
    },
    {
      "id": "annual_actuals",
      "label": "年度実績",
      "completion_status": "linked"
    },
    {
      "id": "budget",
      "label": "予算",
      "completion_status": "linked"
    },
    {
      "id": "settlement",
      "label": "決算",
      "completion_status": "linked"
    },
    {
      "id": "priority_projects",
      "label": "重点事業",
      "completion_status": "linked"
    },
    {
      "id": "contracts",
      "label": "契約",
      "completion_status": "reviewed"
    },
    {
      "id": "assembly",
      "label": "議会",
      "completion_status": "reviewed"
    },
    {
      "id": "audit",
      "label": "監査",
      "completion_status": "linked"
    },
    {
      "id": "executive_manifesto",
      "label": "首長公約",
      "completion_status": "reviewed"
    },
    {
      "id": "publication",
      "label": "公開検証",
      "completion_status": "reviewed"
    }
  ],
  "default_depth": {
    "target_statements": "reviewed",
    "evidence_packets": "reviewed",
    "annual_actuals": "linked",
    "budget": "linked",
    "settlement": "linked",
    "priority_projects": "linked",
    "contracts": "reviewed",
    "assembly": "reviewed",
    "audit": "linked",
    "executive_manifesto": "reviewed",
    "publication": "reviewed"
  },
  "default_work": {
    "status": "complete",
    "next_gate": "publication_verification",
    "next_action_template": "{name}のPhase 10文書スコープ接続と説明責任資料レビューを維持し、個票単位の追加接続は次期深掘り工程で実施する。"
  },
  "overrides": {},
  "completion_rule": {
    "description": "47都道府県すべてについて、政策・Evidence・公開をReviewed、年度実績・予算・決算・重点事業・監査を文書スコープLinked、契約・議会・首長公約を公式一次資料または不存在を断定しない公式検索結果までReviewedとした場合のみPhase 10をcompleteとする。個票単位接続や達成判定は完了条件に含めない。",
    "required_prefecture_count": 47,
    "allow_partial_complete": false
  },
  "policy_achievement_assessment_status": "not_assessed",
  "ranking_eligibility": "excluded_until_comparability_verified",
  "updated_at": "2026-08-01"
}
